{
  "$schema": "https://json-schema.org/draft/2020-12/schema",
  "$id": "https://goal-teams.local/schemas/v2.50/predecessor-release-identity.schema.json",
  "title": "Goal Teams immutable predecessor release identity",
  "type": "object",
  "required": [
    "schema_version",
    "generation_id",
    "predecessor_product_version",
    "release_identity",
    "release_identity_sha256"
  ],
  "properties": {
    "schema_version": {"enum": ["goal-teams-predecessor-release-identity-v2.63", "goal-teams-predecessor-release-identity-v2.65", "goal-teams-predecessor-release-identity-v2.66", "goal-teams-predecessor-release-identity-v2.67", "goal-teams-predecessor-release-identity-v2.68"]},
    "generation_id": {"enum": ["V2.63", "V2.65", "V2.66", "V2.67", "V2.68"]},
    "predecessor_product_version": {"enum": ["V2.62", "V2.63", "V2.65", "V2.66", "V2.67"]},
    "release_identity": {
      "type": "object",
      "required": ["tag", "release_id", "state", "source_commit", "source_tree", "public_assets"],
      "properties": {
        "tag": {"enum": ["v2.62", "v2.63", "v2.65", "v2.66", "v2.67"]},
        "release_id": {"type": "integer", "minimum": 1},
        "state": {"const": "published"},
        "source_commit": {"type": "string", "pattern": "^[0-9a-f]{40}$"},
        "source_tree": {"type": "string", "pattern": "^[0-9a-f]{40}$"},
        "public_assets": {
          "type": "array",
          "minItems": 4,
          "maxItems": 4,
          "uniqueItems": true,
          "items": {"type": "string", "minLength": 1}
        }
      },
      "additionalProperties": false
    },
    "release_identity_sha256": {"type": "string", "pattern": "^[0-9a-f]{64}$"}
  },
  "additionalProperties": false
}
