{
  "schema_version": "goal-teams-predecessor-release-identity-v2.68",
  "generation_id": "V2.68",
  "predecessor_product_version": "V2.67",
  "release_identity": {
    "tag": "v2.67",
    "release_id": 379771898,
    "state": "published",
    "source_commit": "24f522a87b1aa74b6b127962ab88522ddc1f489d",
    "source_tree": "a09be8a212b583cc489125bf2ff3b4e6cbbf9b71",
    "public_assets": [
      "goal-teams-V2.67.tar.gz",
      "SHA256SUMS",
      "_release.json",
      "_files.sha256"
    ]
  },
  "release_identity_sha256": "83a68244ccff6da250a0c80476a099cb54f6e1a25f2f758c23fa604eeabce144"
}
